bps_reference,document_title,bps_permalink
bps04258,"Risk Management And Risk Analysis In Practice (Ncsc)",http://standards.police.uk/bps04258.html
bps52037,"Risk Management Introduction",http://standards.police.uk/bps52037.html
bps17258,"Risk Management Collection (Ncsc)",http://standards.police.uk/bps17258.html
bps96154,"System Administration Architecture (Ncsc)",http://standards.police.uk/bps96154.html
bps09356,"10 Steps - Home And Mobile Working (Ncsc)",http://standards.police.uk/bps09356.html
bps98074,"The Way We Work (Tw3) - Best Practice Guidelines For Smarter Working",http://standards.police.uk/bps98074.html
bps48693,"Understanding User Needs",http://standards.police.uk/bps48693.html
bps35896,"User Research For Government Services - An Introduction",http://standards.police.uk/bps35896.html
bps72081,"Learning About Users And Their Needs",http://standards.police.uk/bps72081.html
bps98201,"Making Your Service Accessible - An Introduction",http://standards.police.uk/bps98201.html
bps43162,"Ncsc Guidelines On Storage Device Disposal",http://standards.police.uk/bps43162.html
bps87590,"Ntracted To A Third Party That Meet Ncsc Assured Service Requirements For Sanitisation (Cas-S) Requirements.",http://standards.police.uk/bps87590.html
bps50914,"Asset Disposal And Information Security Alliance (Adisa):",http://standards.police.uk/bps50914.html
bps87046,"Cpni's Secure Destruction Of Sensitive Items:",http://standards.police.uk/bps87046.html
bps85160,"Code Of Practice For The Deployment And Use Of Body Worn Video (Bwv)",http://standards.police.uk/bps85160.html
bps81630,"Technical Product Documentation And Specification",http://standards.police.uk/bps81630.html
bps70154,"Representation Of Dates And Times -- Part 1:Basic Rules",http://standards.police.uk/bps70154.html
